{
  "module_id": "outremer-military-orders-bw2-bridging-v1",
  "module_title": "Outremer Military Orders (BW2 Bridging v1)",
  "source": {
    "path": "outremer-military-orders-bw2-bridging-v1/rules.json",
    "format": "rules-json"
  },
  "sections": [
    {
      "id": "faction",
      "title": "Faction",
      "json_pointer": "/faction",
      "content_type": "faction"
    },
    {
      "id": "abilities",
      "title": "Abilities",
      "json_pointer": "/abilities",
      "content_type": "abilities"
    },
    {
      "id": "equipment",
      "title": "Equipment",
      "json_pointer": "/equipment",
      "content_type": "equipment"
    },
    {
      "id": "commandGroupUpgrades",
      "title": "Command Group Upgrades",
      "json_pointer": "/commandGroupUpgrades",
      "content_type": "section"
    },
    {
      "id": "factions",
      "title": "Factions",
      "json_pointer": "/factions",
      "content_type": "factions"
    }
  ]
}
